{
  "schema_version": "1.0.0",
  "audit_version": "1.0.0",
  "issue": 424,
  "analysis_only": true,
  "parser_contract": {
    "notation_normalizer_version": "4.0.0",
    "semantic_parser_version": "4.0.0",
    "feature_adapter_version": "4.0.0-opt-in",
    "fixture_catalog_sha256": "26b149f5c4e1bfca12aa48ed6c3183f0f27f257ef039856b213efa7c42ed272c",
    "fixture_schema_version": "1.0.0"
  },
  "inputs": {
    "train": {
      "path": "data/raw/train.csv",
      "sha256": "92418b8441d058cfc68e939dd88725610750be4bc8edc51253cffc72fc4fc0ab"
    },
    "test": {
      "path": "data/raw/test.csv",
      "sha256": "e7e7f29a9b6251308e470ae3fb040a6da0cd8fcb0adb87e67f7761631c6a1ef0"
    },
    "split": {
      "path": "data/splits/stratified_5fold_seed42.csv",
      "sha256": "1a99b82e758948fdf70c014b8270b73f0de805cd2450d119fcb20c08a9b169cf"
    },
    "fixtures": {
      "path": "reports/analysis/parser_contract_v4/fixtures.json",
      "sha256": "26b149f5c4e1bfca12aa48ed6c3183f0f27f257ef039856b213efa7c42ed272c"
    },
    "fixture_schema_sha256": "925ed90195e70d2405549c0dccdebaee7dc3dee3b4e80a4bc2d187d03db746df"
  },
  "constraints": {
    "subclass_used": false,
    "public_lb_used": false,
    "test_prevalence_used_for_decision": false,
    "raw_tokens_preserved": true,
    "model_trained": false
  },
  "datasets": {
    "train": {
      "dataset": "train",
      "samples": 6201,
      "non_wt_gene_cells": 218893,
      "source_token_count": 255164,
      "routed_token_count": 255164,
      "mutation_presence_preserved": true,
      "parse_statuses": {
        "complete": 245152,
        "partial": 9835,
        "unresolved": 177
      },
      "unresolved_reasons": {
        "frameshift": 3,
        "other_unmappable": 174
      },
      "families": [
        {
          "route": "deletion",
          "event_type": "deletion",
          "occurrences": 3,
          "unique_tokens": 3,
          "samples": 3,
          "genes": 3,
          "gene_cells": 3,
          "fold_samples": [
            1,
            0,
            0,
            1,
            1
          ],
          "field_coverage": {
            "positions": {
              "count": 3,
              "fraction": 1.0
            },
            "reference": {
              "count": 1,
              "fraction": 0.3333333333333333
            },
            "alternate": {
              "count": 0,
              "fraction": 0.0
            },
            "range_endpoints": {
              "count": 3,
              "fraction": 1.0
            },
            "length": {
              "count": 3,
              "fraction": 1.0
            },
            "stop_semantics": {
              "count": 3,
              "fraction": 1.0
            },
            "hgvs_conformance": {
              "count": 3,
              "fraction": 1.0
            },
            "position_eligibility": {
              "count": 3,
              "fraction": 1.0
            }
          }
        },
        {
          "route": "frameshift",
          "event_type": "frameshift",
          "occurrences": 9833,
          "unique_tokens": 6546,
          "samples": 3274,
          "genes": 2719,
          "gene_cells": 9463,
          "fold_samples": [
            644,
            651,
            666,
            647,
            666
          ],
          "field_coverage": {
            "positions": {
              "count": 9833,
              "fraction": 1.0
            },
            "reference": {
              "count": 9833,
              "fraction": 1.0
            },
            "alternate": {
              "count": 1217,
              "fraction": 0.12376690735279162
            },
            "range_endpoints": {
              "count": 0,
              "fraction": 0.0
            },
            "length": {
              "count": 0,
              "fraction": 0.0
            },
            "stop_semantics": {
              "count": 0,
              "fraction": 0.0
            },
            "hgvs_conformance": {
              "count": 0,
              "fraction": 0.0
            },
            "position_eligibility": {
              "count": 0,
              "fraction": 0.0
            }
          }
        },
        {
          "route": "range_replacement",
          "event_type": "range_replacement",
          "occurrences": 109,
          "unique_tokens": 103,
          "samples": 101,
          "genes": 98,
          "gene_cells": 108,
          "fold_samples": [
            11,
            22,
            23,
            24,
            21
          ],
          "field_coverage": {
            "positions": {
              "count": 109,
              "fraction": 1.0
            },
            "reference": {
              "count": 109,
              "fraction": 1.0
            },
            "alternate": {
              "count": 109,
              "fraction": 1.0
            },
            "range_endpoints": {
              "count": 109,
              "fraction": 1.0
            },
            "length": {
              "count": 0,
              "fraction": 0.0
            },
            "stop_semantics": {
              "count": 109,
              "fraction": 1.0
            },
            "hgvs_conformance": {
              "count": 0,
              "fraction": 0.0
            },
            "position_eligibility": {
              "count": 109,
              "fraction": 1.0
            }
          }
        },
        {
          "route": "range_replacement",
          "event_type": "stop_containing",
          "occurrences": 39,
          "unique_tokens": 36,
          "samples": 34,
          "genes": 32,
          "gene_cells": 39,
          "fold_samples": [
            9,
            7,
            8,
            2,
            8
          ],
          "field_coverage": {
            "positions": {
              "count": 39,
              "fraction": 1.0
            },
            "reference": {
              "count": 39,
              "fraction": 1.0
            },
            "alternate": {
              "count": 39,
              "fraction": 1.0
            },
            "range_endpoints": {
              "count": 39,
              "fraction": 1.0
            },
            "length": {
              "count": 0,
              "fraction": 0.0
            },
            "stop_semantics": {
              "count": 39,
              "fraction": 1.0
            },
            "hgvs_conformance": {
              "count": 0,
              "fraction": 0.0
            },
            "position_eligibility": {
              "count": 39,
              "fraction": 1.0
            }
          }
        },
        {
          "route": "range_replacement",
          "event_type": "stop_gain",
          "occurrences": 24,
          "unique_tokens": 23,
          "samples": 23,
          "genes": 22,
          "gene_cells": 23,
          "fold_samples": [
            3,
            6,
            7,
            3,
            4
          ],
          "field_coverage": {
            "positions": {
              "count": 24,
              "fraction": 1.0
            },
            "reference": {
              "count": 24,
              "fraction": 1.0
            },
            "alternate": {
              "count": 24,
              "fraction": 1.0
            },
            "range_endpoints": {
              "count": 24,
              "fraction": 1.0
            },
            "length": {
              "count": 0,
              "fraction": 0.0
            },
            "stop_semantics": {
              "count": 24,
              "fraction": 1.0
            },
            "hgvs_conformance": {
              "count": 0,
              "fraction": 0.0
            },
            "position_eligibility": {
              "count": 24,
              "fraction": 1.0
            }
          }
        },
        {
          "route": "range_replacement",
          "event_type": "synonymous",
          "occurrences": 67,
          "unique_tokens": 60,
          "samples": 47,
          "genes": 58,
          "gene_cells": 63,
          "fold_samples": [
            5,
            9,
            15,
            6,
            12
          ],
          "field_coverage": {
            "positions": {
              "count": 67,
              "fraction": 1.0
            },
            "reference": {
              "count": 67,
              "fraction": 1.0
            },
            "alternate": {
              "count": 67,
              "fraction": 1.0
            },
            "range_endpoints": {
              "count": 67,
              "fraction": 1.0
            },
            "length": {
              "count": 0,
              "fraction": 0.0
            },
            "stop_semantics": {
              "count": 67,
              "fraction": 1.0
            },
            "hgvs_conformance": {
              "count": 0,
              "fraction": 0.0
            },
            "position_eligibility": {
              "count": 67,
              "fraction": 1.0
            }
          }
        },
        {
          "route": "substitution",
          "event_type": "missense",
          "occurrences": 164740,
          "unique_tokens": 80439,
          "samples": 6017,
          "genes": 4222,
          "gene_cells": 146359,
          "fold_samples": [
            1210,
            1208,
            1200,
            1201,
            1198
          ],
          "field_coverage": {
            "positions": {
              "count": 164740,
              "fraction": 1.0
            },
            "reference": {
              "count": 164740,
              "fraction": 1.0
            },
            "alternate": {
              "count": 164740,
              "fraction": 1.0
            },
            "range_endpoints": {
              "count": 0,
              "fraction": 0.0
            },
            "length": {
              "count": 0,
              "fraction": 0.0
            },